Survey,clean_text,Label
"Bu harum guru yang baik dan sebenarnya sangat sesuai dengan kualifikasi. Namun, metode mengajar nya saya rasa tidak sesuai kkrena Siswa tidak mendapatkan materi yang sesuai dan harusnya didapatkan. Komunikasi sangat buruk karena, beliau sangat slowrespon dan tidak mau dihubungi selain daripada perwakilan kelas dan itu sangat tidak efektif, karena menurut saya Siswa akan membutuhkan komunikasi secara intens dg guru yang mengampu. Mohon maaf dan Terima kasih.",bu harum guru baik benar sangat sesuai kualifikasi metode ajar nya rasa tidak sesuai kkrena siswa tidak dapat materi sesuai harus dapat komunikasi sangat buruk beliau sangat slowrespon tidak mau hubung daripada wakil kelas itu sangat tidak efektif turut siswa butuh komunikasi intens dg guru ampu mohon maaf terima kasih,negatif
Untuk kedepannya mungkin bisa sekalikali Bapak nya yang menyampaikan materi,depan mungkin sekalikali bapak nya sampai materi,negatif
Untuk tempat pengumpulan tugas jangan di batasi waktu,tempat kumpul tugas jangan batas waktu,negatif
kemampuan Guru untuk menjabarkan materi sudah sangat baik,mampu guru jabar materi sangat baik,positif
"pak baik,cuman kadang lupa waktu wkwk",pak baik cuman kadang lupa waktu wkwk,negatif
Belum ada terima kasih,belum terima kasih,positif
sehat selalu bapak/ibu,sehat selalu bapak ibu,positif
Ilmunya,ilmu,positif
bisa diperbaiki lagi,baik,positif
Sehat selalu bu,sehat selalu bu,positif
sudah sangat baik saat menyampaikan materi,sangat baik sampai materi,positif
Semoga lebih baik lg kedepannya,moga lebih baik lg depan,positif
makasih pak,makasih pak,positif
tidak ada karena sudah sangat efisein dan baik dalam mengajar,tidak karena sangat efisein baik ajar,positif
semangat dan terima kasih,semangat terima kasih,positif
"jika berkenan, Ibu guru mungkin bisa menghadirkan variasi mengajar baru dengan memberikan isuisu relevan pada masa kini yang berkaitan juga dengan Pelajaran yang diajarkan",kenan ibu guru mungkin hadir variasi ajar baru beri isuisu relevan masa kini kait dengan ajar ajar,negatif
Semoga selalu diberkati dalam setiap pekerjaan,moga selalu kati tiap kerja,positif
jangan terlalu banyak slide pada saat Pelajaran.,jangan terlalu banyak slide saat ajar,negatif
"Ibu ,saya tidak berkomenta tentang apapun.",ibu tidak berkomenta apa,positif
mohon maaf pak saya tidak ada saran,mohon maaf pak tidak saran,positif
semangat sudah baik,semangat baik,positif
semoga kedepannya bisa pembelajaran full ofline,moga depan ajar full ofline,negatif
untuk pembelajaran sudah sangat baik,ajar sangat baik,positif
Tetap menjadi yang terbaik pak ¿¿¿¿¿¿¿¿,tetap jadi baik pak,positif
Kalau dari saya sudah bagus ibu dalam memberikan materi terimakasih ¿¿¿¿¿¿¿¿,kalau saya bagus ibu beri materi terimakasih,positif
tidak ada karena sudah cukup baik menurut saya,tidak karena cukup baik saya,positif
belum ada saran,belum saran,positif
Good,good,positif
"Untuk saran dari saya Pelajaran bahasa indonesia ini sudah sangat baik, kita sebagai Siswa sudah cukup paham dan mengerti dalam menerima materi yang disampaikan oleh Guru, terimakasih",saran saya ajar bahasa indonesia sangat baik bagai siswa sudah cukup paham erti terima materi sampai guru terimakasih,positif
supaya lebih lagi dalam menceritakan pengalaman yang sudah pernah di alami,lebih dalam cerita alam sudah pernah alami,positif
sebaiknya lebih interaktif lagi dalam menyampaikan materi,baik lebih interaktif dalam sampai materi,positif
jadwalnya juga kepagian bu,jadwal pagi bu,negatif
Tidak ada saran sangat baik dalam mengajar,tidak saran sangat baik ajar,positif
Semoga kegiatan pembelajaran kedepannya dapat lebih baik dari yang sebelumnya dan dilancarkan juga kegiatannya,moga giat ajar depan lebih baik yang belum lancar giat,positif
layak dikatakan guru panutan.,layak kata guru panutan,positif
Selalu jaga kesehatan pak ilmu bapak kami perlukan,selalu jaga sehat pak ilmu bapak perlu,positif
Sangat friendly,sangat friendly,positif
"sudah cukup sangat baik, saat Bu menjelaskan materi maupun tugas",cukup sangat baik bu jelas materi maupun tugas,positif
mudah paham saat memberi materi tetapi lebih baik lebih perlahan lagi saat menerangkan materi,mudah paham beri materi lebih baik lebih perlahan saat terang materi,positif
Guru sangat bagus,guru sangat bagus,positif
Semangat untuk pak,semangat pak,positif
Sudah cukup baik.,cukup baik,positif
semoga kedepan selalu jossssss,moga depan selalu jossssss,positif
materi yang berikan sangat mudah dipahami oleh Siswa,materi ikan sangat mudah paham siswa,positif
secara penyampaian materi karena kelas diadakan secara online jadi dalam penyampaian materi terkadang kurang jelas karena faktor sinyal atau hal lainnya,sampai materi kelas ada online jadi sampai materi terkadang kurang jelas faktor sinyal hal lain,negatif
semoga dapat meningkatkan kinerja,moga tingkat kerja,positif
semangat Pak,semangat pak,positif
Lebih banyaj materi dari guru dripada Siswa,lebih banyaj materi guru dripada siswa,positif
baik dan teruskan,baik terus,positif
semoga pelajaran yang disampaikan tidak hanya bersumber dari presentasi Siswa saja karena Siswa yang menjelaskan materi belum tentu menguasainya... mungkin dari metode seperti itu banyak yang terkendala dalam memahami materi pelajaran pada Pelajaran,moga ajar sampai tidak sumber presentasi siswa karena siswa jelas materi belum kuasa mungkin metode itu banyak kendala paham materi ajar ajar,negatif
lebih pelan pelan lagi mengajarnya,lebih pelan pelan ajar,negatif
Semoga kedepannya bisa terus Istiqomah dalam mengajarkan ilmu kepada murid dan terus berkembang sehingga sangat menguasai materi yang akan di ajarkan,moga depan terus istiqomah ajar ilmu murid terus kembang sangat kuasa materi akan ajar,negatif
penyampaian materi lebih detail lagi supaya Siswa lebih mngerti materi yang disampaikan,sampai materi lebih detail supaya siswa lebih mngerti materi sampai,negatif
Memberi sedikit latihan soal (bukan tugas) sebagai absensi mungkin bisa lebih memotivasi siswa.,beri sedikit latih soal bukan tugas absensi mungkin lebih motivasi siswa,negatif
Semoga tambah bersemangat dalam mengajar,moga tambah semangat ajar,positif
SEMOGA SEHAT SELALU IBU,moga sehat selalu ibu,positif
Semangat Buu,semangat buu,positif
Mohon untuk materinya dapat di akses kembali. Minimal sebelum dilaksanakan ujian penting,mohon materi di akses minimal belum laksana uji penting,positif
penjelasan materinya dibuat menarik lagi agar Siswa tidak ngantuk dan juga untuk praktikum sebaiknya di berikan materi terlebih dahulu agar Siswa bisa lebih mudah ketika mengerjakan,jelas materi buat tarik agar siswa tidak ngantuk juga praktikum baik ikan materi lebih agar siswa lebih mudah kerja,negatif
terimakasih bu atas ilmu dan kesabaran terhadap kelas kami,terimakasih bu atas ilmu sabar kelas,positif
untuk pengajaran bisa lebih pelan menjelaskan materinya karena banyak Siswa masih kurang paham pada mapel tersebut,ajar lebih pelan jelas materi banyak siswa kurang paham mapel sebut,negatif
"Semangat, Bu.",semangat bu,positif
"Kinerja guru sudah cukup baik, cukup dipertahankan saja.",kerja guru cukup baik cukup tahan,positif
materi yang di sampaikan menarik dan mudah di pahami oleh Siswa,materi sampai tarik mudah di paham siswa,positif
"Kesan saya bapak ini orangnya sangat baik walaupun terlihat tegas tapi aslinnya baik banget, mudah diajak bercanda, dan pesan dari saya",kesan bapak orang sangat baik walaupun lihat tegas aslinnya baik banget mudah ajak canda pesan saya,positif
lebih jelas lagi menjalaskan materinya,lebih jelas menjalaskan materi,positif
lebih meningkatkan kualitas mengajar,lebih tingkat kualitas ajar,negatif
"mohon untuk diluluskan dalam Pelajaran perilaku organisasi dan mendapatkan nilai yang bagus, terima kasih bu",mohon lulus ajar perilaku organisasi dapat nilai bagus terima kasih bu,positif
"Pak asik kalau ngajar, humorissss. Btw cari meme dimana pak?",pak asik kalau ngajar humorissss btw cari meme pak,positif
penyampaian materi sudah sangat bagus tetapi dikarenakan mapel yang susah jadi sangat susah untuk memahami,sampai materi sangat bagus karena mapel susah jadi sangat susah paham,positif
"Terimakasih bu , semoga bisa bertemu disemester selanjutnya",terimakasih bu moga temu semester lanjut,positif
guru favorite,guru favorite,positif
udah baik,udah baik,positif
"Saran dari saya mungkin ada beberapa : 1) Lebih mendalami materi yang akan disampaikan, 2) Modul pembelajaran lebih baik full bahasa Indonesia, 3) Ketika ada pembahasan soal lebih baik dijelaskan secara rinci asal usulnya dari mana, jangan langsung to the point",saran saya mungkin beberapa lebih dalam materi akan sampai modul ajar lebih baik full bahasa indonesia ada bahas soal lebih baik jelas rinci asal usul mana jangan langsung to the point,negatif
Semoga bu sehat selalu.,moga bu sehat selalu,positif
terlalu cepat dalam berbicara,terlalu cepat bicara,negatif
Mudah dipahami,mudah paham,positif
Kepedapannya bisa menjadi lebih baik lagi,dap jadi lebih baik,positif
"tidak ada , karena guru sendiri memang tidak pernah izin selama kelas berlangsung dan penyampaian materi nya lebih diserahkan ke Siswa agar kami mampu menyelesaikan soal terlebih dahulu , dan disusul dengan penjelasan rinci dari guru",tidak karena guru sendiri memang tidak pernah izin lama kelas langsung sampai materi nya lebih serah siswa kami mampu selesai soal lebih dan susul jelas rinci guru,positif
"dalam menyampaikan materi lebih baik dijelaskan dulu tentang materinya,jangan langsung menunjuk Siswa karena tidak semua Siswa memiliki pemikiran yg kritis &bisa langsung menjelaskan materi yg ditujukan",sampai materi lebih baik jelas dulu materi jangan langsung tunjuk siswa tidak semua siswa milik pikir yg kritis langsung jelas materi yg tuju,negatif
Tidak ada. Terima Kasih,tidak terima kasih,positif
untuk pesan atau kritik semoga Bapak lebih maju lagi kedepannya dan senantiasa memberikan Siswa yang terbaik,pesan kritik moga bapak lebih maju depan senantiasa beri siswa baik,positif
kurang dalam menjelaskan materi dan terlalu terburuburu sehingga sulit dimengerti terhadap materinya,kurang jelas materi terlalu terburuburu sulit erti materi,positif
Pelaksanaan quiz yang terlalu mendadak,laksana quiz terlalu dadak,negatif
"Di setiap materi yang diberikan per minggu, hendaknya diberikan tugas tujuannya untuk mengevaluasi hasil pemahaman / penguasaan Siswa terhadap materi yang telah disampaikan setiap minggunya, jadi jangan hanya langsung diberikan tugas akhir saja tanpa ada latihan tugas perminggu nya.",materi beri per minggu hendak beri tugas tuju evaluasi hasil paham kuasa siswa materi telah sampai tiap minggu jadi jangan langsung beri tugas akhir tanpa latih tugas minggu nya,negatif
For the greater good,for the greater good,positif
mungkin lebih detail untuk praktikumnya pak,mungkin lebih detail praktikum pak,negatif
secara keseluruhan pengajaran sangat baik,seluruh ajar sangat baik,positif
Terima kasih dengan semua ajarannya sehat selalu dan bertambah rezekinya¿¿¿¿¿¿¿¿,terima kasih semua ajar sehat selalu tambah rezeki,positif
"Untuk penugasan, kalau bisa bu di jelaskan sedetail detailnya walaupun materinya udah di sampaikan, cara mengerjakan tugas nya juga harus di jelaskan satu persatu biar nyambung bu ga salah nangkap, Terimakasih",tugas kalau bu jelas detail detail walaupun materi udah sampai cara kerja tugas nya harus jelas satu satu biar nyambung bu ga salah nangkap terimakasih,negatif
sudah cukup baik cuman untuk kejelasan jam Pelajarannya agak kurang,cukup baik cuman jelas jam ajar kurang,positif
Bapaknya sangat baik dan perhatian semoga terus mengampu di,bapak sangat baik perhati moga terus ampu,positif
penyampaian materi,sampai materi,positif
Sudah sangat baik.,sangat baik,positif
"untuk pembelajaran sudah bagus, sarannya seringsering offline pembelajarannya.",ajar bagus saran seringsering offline ajar,negatif
Semangat bu,semangat bu,positif
Sudah baik dan semoga bisa lebih baik lagi kedepannya,baik moga lebih baik depan,positif
Tolong lebih ditingkatkan lagi,lebih tingkat,positif
be better,be better,positif
Sudah cukup baik dan di tingkatkan untuk kedepannya,cukup baik di tingkat depan,positif
sangat baik dan untuk lebih sering berinteraksi dengan Siswa,sangat baik untuk lebih sering interaksi siswa,negatif
Pertahankan gaya mengajar yang menarik pak,tahan gaya ajar tarik pak,positif
"Sejauh ini tidak ada saran yang spesifik, karena cara penyampaian dan mengajar ibu mudah dipahami dan diikuti.",jauh tidak saran spesifik cara sampai ajar ibu mudah paham ikut,positif
ngasih tugas jangan ynag susah bu kita yang kewalahan bu ngerjainnya,ngasih tugas jangan ynag susah bu yang kewalahan bu ngerjainnya,negatif
semoga lebih dapat memahami murid,moga lebih paham murid,positif
"belum ada saran, guru sangat bagus dalam mengajari siswa.",belum saran guru sangat bagus ajar siswa,positif
"lebih dijadwalkan untuk kelas offline jika memang bisa mengajar para Siswa , karena ada beberapa kesempatan para murid ingin lebih banyak berinteraksi saat pelajaran untuk menanyakan lebih detail tentang hal yang tidak diketahui kepada guru",lebih jadwal kelas offline memang ajar siswa ada beberapa sempat murid lebih banyak interaksi ajar tanya lebih detail hal tidak tahu guru,negatif
Sangat baiko,sangat baiko,positif
Sebaiknya ketika menyampaikan materi lebih pelan pelan dan lebih rinci lagi agar kita paham dengan materinya,baik sampai materi lebih pelan pelan lebih rinci agar paham materi,negatif
Sarannya untuk sudah baik,saran sudah baik,positif
"sangat senang dengan pembawaan pak , Gbu pak",sangat senang bawa pak gbu pak,positif
untuk materi dapat saya terima dengan baik semoga kedepanya lebih baik amin,materi saya terima baik moga depa lebih baik amin,positif
Semoga guru pancasilanya tetap,moga guru pancasila tetap,positif
ditingkatkan metode pengajaran,tingkat metode ajar,positif
lebih rileks saat mengajar,lebih rileks ajar,positif
Kedepannya makin lebih baik lagi,depan makin lebih baik,positif
tidak ada saran lebih lanjut.,tidak saran lebih lanjut,positif
pak guru menguasai paham akan materi,pak guru kuasa paham materi,positif
TERIMAKASIH PAK ATAS ILMU NYA SEMOGA BERMANFAAT,terimakasih pak atas ilmu nya moga manfaat,positif
"lebihh detail dalam menjelaskan, media pembelajaran tidak video dan penjelasan perlahan lahan agar dipahami seluruh Siswa dengan baik",lebihh detail jelas media ajar tidak video jelas perlahan lahan paham seluruh siswa baik,negatif
"Untuk saran dari saya Pelajaran pengantar teknik industri ini sudah cukup baik, kita sebagai Siswa sudah cukup paham dan mengerti dalam menerima materi yang disampaikan oleh Guru, terimakasih",saran saya ajar antar teknik industri cukup baik bagai siswa sudah cukup paham erti terima materi sampai guru terimakasih,positif
ini tubes bukan skripsi jadi yang normal normal saja pak,tubes bukan skripsi jadi normal normal pak,negatif
untuk penjelasan materi sudah sangat baik.,jelas materi sangat baik,positif
seharusnya ibunya lebih responsif ketika dihubungi via online,ibu lebih responsif hubung via online,negatif
Tetap semangat !,tetap semangat,positif
semoga bisa offline di semester selanjutnya,moga offline semester lanjut,negatif
Semangat teruss pak buat kedepannya,semangat teruss pak buat depan,positif
cara mengajarnya sedikit kecepetan jadi saya cukup sulit memahaminya,cara ajar sedikit kecepetan jadi cukup sulit paham,negatif
"Dimohon kepada guru ketika memberi ilmu dengan suara yang halus dan tidak dengan nada yang tinggi dan sangat cepat. Kemudian ketika berkomunikasi kepada siswa/i dengan santai dan tidak berbicara dengan nada tinggi. Namun, secara keseluruhan guru telah melakukan pembelajaran dengan baik dan terimakasih telah memberi ilmu pada semester ini.",mohon guru beri ilmu suara halus tidak nada tinggi sangat cepat kemudian komunikasi siswa i santai tidak bicara nada tinggi cara seluruh guru laku ajar baik terimakasih beri ilmu semester,negatif
Untuk mapelnya klo bisa offline,mapelnya klo offline,negatif
Terima kasih Bpk/Ibu Guru,terima kasih bpk ibu guru,positif
Spontan?,spontan,positif
semoga bisa lebih baik kembali,moga lebih baik,positif
Pemberian materi terkadang kurang runtut,beri materi terkadang kurang runtut,negatif
Untuk saran tidak ada dikarenakan dalam menjelaskan sebuah materi sangat baik,saran tidak karena jelas buah materi sangat baik,positif
Aspraknya baik,asprak baik,positif
materi yang diberikan mudah dipahami dan tugas yang diberikan menambah wawasan luas bagi Siswa,materi beri mudah paham tugas beri tambah wawas luas siswa,positif
Semoga kedepannya ibu mengajar lebih asik lagi,moga depan ibu ajar lebih asik,positif
Sudah baik dan semoga tetap konsisten bahkan lebih baik,baik moga tetap konsisten bahkan lebih baik,positif
"Sebaiknya, suara bu sedikit dikeraskan volume nya. Seringkali Siswa termasuk saya seolah mendekatkan telinga ketika bu menjelaskan.",baik suara bu sedikit keras volume nya seringkali siswa masuk olah dekat telinga bu jelas,negatif
Semoga kedepannya lebih di kontrol emosi nya bu,moga depan lebih kontrol emosi nya bu,negatif
Saran untuk menambahkan modul odoo dan lebih terperinci dalam memberikan implementasi serta cara penggunaan odoo,saran tambah modul odoo lebih perinci beri implementasi cara guna odoo,negatif
kurang pembelajaran tatap muka,kurang ajar tatap muka,negatif
Terimakasih pak,terimakasih pak,positif
Gurunya mantap,guru mantap,positif
"Alhamdulillah sangat baik, mungkin untuk kedepannya bisa diadakan secara offline agar lebih cepat menyerap ilmu dari guru dan menambah keberkahan ilmu",alhamdulillah sangat baik mungkin depan ada offline lebih cepat serap ilmu guru tambah berkah ilmu,negatif
guru keren,guru keren,positif
terimakasih ilmu dan materi yang telah diberikan,terimakasih ilmu materi telah beri,positif
Lebih meningkatkan dalam penyampaian materi agar lebih baik lagi,lebih tingkat sampai materi lebih baik,negatif
Semangattt pak,semangattt pak,positif
Alhamdulillah tidak ada kendala,alhamdulillah tidak kendala,positif
sedikit lebih dikembangkan lagi dengan materi yang tidak hanya dari menonton youtube atau video. untuk pembelajran cukup baik,sedikit lebih kembang dengan materi tidak dari tonton youtube video pembelajran cukup baik,negatif
tetap mengajar dengan profesional,tetap ajar profesional,positif
sudah baik. saya senang mempelajari manajemen proyek dengan bu,baik senang ajar manajemen proyek bu,positif
Semangat untuk mengajar dalam Pelajaran,semangat ajar ajar,positif
Mohon maaf Bu pertemuan di semester ini bisa dihitung jari. Saya merasa kurang belajar,mohon maaf bu temu semester bisa hitung jari rasa kurang ajar,negatif
Lebih memperbanyak variasi latihan soal dalam penerapan di setiap bab nya,lebih banyak variasi latih soal terap tiap bab nya,negatif
kurangin pertanyaan mematikan bu :),rangin tanya mati bu,negatif
Menyampaikan materi lebih jelas lagi,sampai materi lebih jelas,negatif
Penyampaian materi dari guru sudah cukup baik namun kurang memberi contoh atau studi kasus dari materi yang diberikan,sampai materi guru cukup baik kurang beri contoh studi kasus materi beri,negatif
"menjanjikan Siswa Pelajaran offline akan tetapi belum terlaksana sampai akhir semester, untuk yang lain saya rasa cukup baik",janji siswa ajar offline tetapi belum laksana akhir semester yang saya rasa cukup baik,negatif
Jangan terlalu cepat untuk menyampaikan materi,jangan terlalu cepat sampai materi,negatif
Terimakasih sudah membimbing selama 1 semester Bu.,terimakasih bimbing lama semester bu,positif
penyampaian materi lebih menarik dan mudah dipahami,sampai materi lebih tarik mudah paham,positif
"Sejauh ini tidak ada saran yang spesifik untuk Pelajaran ini, karena cara penyampaian dan mengajar ibu yang sabar dan rinci sehingga mudah dipahami dan diikuti.",jauh tidak saran spesifik ajar karena cara sampai ajar ibu sabar rinci mudah paham ikut,positif
Untuk kedepannya mungkin bisa diberi video pembelajaran tentang materi yang diberikan. Terima kasih bapak atas materi dan bimbingannya selama satu semester ini.,depan mungkin beri video ajar materi beri terima kasih bapak atas materi bimbing lama satu semester,negatif
sangat baiik,sangat baiik,positif
"Ngga ada saran,bu Gurunya udah mantep",ngga saran bu guru udah mantep,positif
"Untuk segala aspek sudah baik atau sangat baik. Namun, untuk kedepannya harus tetap ditingkatkan lagi.",segala aspek baik sangat baik untuk depan tetap tingkat,positif
sangat baik secara keseluruhan,sangat baik seluruh,positif
"Saran dari saya, jika berkenan pak perlu menghadirkan variasi mengajar baru dengan memberikan isuisu relevan pada masa kini.",saran saya kenan pak perlu hadir variasi ajar baru beri isuisu relevan masa kini,negatif
Untuk pengajaran sudah baik dan bisa untuk di pertahankan,ajar baik bisa di tahan,positif
Kurang pendekatan pada Siswa,kurang dekat siswa,negatif
"Tidak ada saran, karena untuk proses belajar mengajar bapak sangat baik",tidak saran untuk proses ajar ajar bapak sangat baik,positif
semangat terus pak,semangat terus pak,positif
mohon diperbaiki yang kurang performanya sebagai guru,mohon baik kurang performa guru,positif
Sudah cukup baik menurut saya,cukup baik saya,positif
maaf belum bisa menjadi murid yang baik,maaf belum jadi murid baik,positif
Keep it strong,keep it strong,positif
"Alhamdulillah saya rasa sudah sangat baik semuanya, terima kasih",alhamdulillah rasa sangat baik semua terima kasih,positif
Mendapatkan nilai lebih baik,dapat nilai lebih baik,positif
Sudah baik saat memberikan materi,baik beri materi,positif
Pembelajaran kimia bisa dilakukan secara offline,ajar kimia laku offline,negatif
"Pada saat praktikum, jika ada Siswa bertanya error, mohon dibantu menyelesaikan.",saat praktikum ada siswa tanya error mohon bantu selesai,negatif
"Saran dari saya, semoga ibu dapat memperpanjang batas waktu pengumpulan tugas",saran saya moga ibu panjang batas waktu kumpul tugas,negatif
"Untuk setiap materi yang diberikan sudah baik, berguna untuk kita kedepannya. Tetapi untuk metode pengajarannya yang perlu diperbaiki lagi, misalnya mengadakan Pelajaran tamu dengan pemateri atau Pelajaran offline minimal 2 kali dalam sebulan, juga di tengahtengah materi bisa diberikan umpan balik kepada manusia. Dikarenakan Pelajaran online (zoom) dan materi yang diberikan masih terbilang asing serta pemaparannya yang panjang dapat mengurangi fokus Siswa terhadap materi yang diberikan. Jikalau memungkinkan juga dapat diadakannya kunjungan ke perusahaan, lembaga ataupun instansi terkait MTL, agar Siswa dapat mengenal lebih dekat, mengamati dan melihat secara langsung proyekproyek dan cara kerja perusahaan.",tiap materi beri baik guna kita depan untuk metode ajar perlu baik misal ada ajar tamu materi ajar offline minimal kali bulan di tengahtengah materi beri umpan balik manusia karena ajar online zoom materi beri bilang asing papar panjang kurang fokus siswa materi beri jikalau mungkin ada kunjung usaha lembaga atau instansi kait mtl siswa dapat kenal lebih dekat amat lihat langsung proyekproyek cara kerja usaha,negatif
sudah baik sekali. saya senang belajar pemrograman web dengan bu,baik sekali senang ajar pemrograman web bu,positif
sudah cukup baik dalam penyampaian materi,cukup baik sampai materi,positif
terimakasih Pak telah mengajar saya. mohon bimbingannya kedepan,terimakasih pak ajar mohon bimbing depan,positif
Lebih semangat meningkatkan kinerja,lebih semangat tingkat kerja,negatif
"guru tidak terlalu ikut andil dalam pemberian materi, dan materi yang disampaikan pemateri terlalu luas jangkauannya sehingga kesulitan untuk mengikuti",guru tidak terlalu ikut andil beri materi materi sampai materi terlalu luas jangkau sulit ikut,negatif
semua sudahh sangat baik dalam mengajar,semua sudahh sangat baik ajar,positif
"Tambahan variasi tugas, agar lebih banyak referensi penilaian, tidak hanya dari tugas tulis.",tambah variasi tugas lebih banyak referensi nilai tidak dari tugas tulis,negatif
"Lebihh detaill lagi dalam menjelaskan, karena mapel ini susah bagi yang tidak ada basic ekonomi di sekolahnya dulu:(",lebihh detaill dalam jelas mapel susah yang tidak basic ekonomi sekolah dulu,negatif
sangat mantap,sangat mantap,positif
sudah cukup baik dalam menyampaikan materi,cukup baik sampai materi,positif
Lebih jelas lagi dalam hal menyampaikan materi dan tugas,lebih jelas dalam sampai materi tugas,negatif
materinya harus lebih dibuka,materi lebih buka,negatif
semoga semakin mudah dalam mengajarkan matematika optimasi dan riset operasi,moga makin mudah ajar matematika optimasi riset operasi,negatif
Memberikan materi / wawasan yang lebih luas tentang sains data,beri materi wawas lebih luas sains data,positif
Semoga kedepannya kegiatan belajar mengajar dapat berjalan dengan lebih baik dan dilakukan secara offline,moga depan giat ajar ajar jalan lebih baik laku offline,negatif
Tek ada,tek,positif
Mungkin lebih diajarkan banyak teori terlebih dahulu bukan praktek tanpa teori yang di ajarkan,mungkin lebih ajar banyak teori lebih bukan praktek teori di ajar,negatif
mampu memberikan arahan dalam penulisan laporan kerja praktik yang benar,mampu beri arah tulis lapor kerja praktik benar,positif
Pak kalau menjelaskan dengan cerita memang bagus tapi terkadang membuat Siswa ngantuk pak,pak kalau jelas cerita memang bagus terkadang buat siswa ngantuk pak,negatif
Tambah baik dalam mengajar,tambah baik ajar,positif
semoga kedepannya bisa mengajar tanpa digantikan asisten,moga depan ajar ganti asisten,negatif
mayoritas guru sudah cukup bagus namun ada beberapa guru cara penyampaian materinya kurang maksimal,mayoritas guru cukup bagus ada beberapa guru cara sampai materi kurang maksimal,negatif
"Sudah cukup baik, hanya saja akan lebih baik jika kelas dilakukan secara offline",cukup baik saja lebih baik kelas laku offline,negatif
mampu memberikan mekanisme belajar yang baik,mampu beri mekanisme ajar baik,positif
