Survey,clean_text,Label
Penyampaian materi sudah baik dan mudah dipahami. Semoga bisa dipertahankan dan lebih semangat lagi. Terimakasih atas ilmunya bu,sampai materi baik mudah paham moga tahan lebih semangat terimakasih atas ilmu bu,positif
Maaf saya tidak tahu bagaimana beliau dalam mengajar karena selama satu semester ini beliau menggunakan mbak asisten yang saya kira mbak asisten tsb sangat baik dalam mengajar membuat saya insecure padahal mbak asisten masih semester 5 sudah punya skill seperti itu.,maaf tidak tahu bagaimana beliau ajar lama satu semester beliau guna mbak asisten kira mbak asisten tsb sangat baik ajar buat saya insecure padahal mbak asisten semester punya skill itu,positif
sumpa lebih baik dalam sistem dan metode pengajaran,sumpa lebih baik sistem metode ajar,positif
Semoga lebih baik dri hari sebelumnya,moga lebih baik dri hari belum,positif
Nilai A+ pak¿¿¿¿,nilai a pak,positif
Tidak ada. Semoga bisa bertemu lagi di semester depan. Terima kasih pak,tidak moga temu di semester depan terima kasih pak,positif
The bestt,the bestt,positif
sudah sangat baik,sangat baik,positif
saran dari saya ibu tolong perbanyak latihan soalnya,saran saya ibu banyak latih soal,negatif
Saya berharap kedepannya materi bapak menjadi mudah untuk difahami ¿¿¿¿,harap depan materi bapak jadi mudah difahami,negatif
Sudah melakukan yang terbaik,laku baik,positif
baik silp,baik silp,positif
Profesional,profesional,positif
semoga lebih seru lagi dalam mengajar agar siswa/mahasiswi dapat mudah menyerap materi yang disampaikan,moga lebih seru dalam ajar siswa mahasiswi mudah serap materi sampai,positif
Bapak Guru sudah sangat baik dalam menjelaskan Materi dan memberi kesempatan berinteraksi,bapak guru sangat baik jelas materi beri sempat interaksi,positif
Setidaknya ada kelanjutan materi yg akan dibahas,tidak lanjut materi yg bahas,negatif
terimakasih pak ilmu dan pembelajarannya,terimakasih pak ilmu ajar,positif
"mungkin lebih kreatif lagi saat menyampaikan materi, overall udah bagus",mungkin lebih kreatif saat sampai materi overall udah bagus,negatif
Tugas yang sesuai,tugas sesuai,positif
"Keep it going untuk bapak/ibu, respect for all of you.",keep it going bapak ibu respect for all of you,positif
baik saja dalam 1 semester ini,baik dalam semester,positif
terima kasih,terima kasih,positif
Tetap semangat pak untuk mengajarnya sehat selalu pak...,tetap semangat pak ajar sehat selalu pak,positif
Lebih di jelaskan lagi materinya mungkin perumpamaan yang di sampaikan kurang related dengan materi.,lebih jelas materi mungkin umpama di sampai kurang related materi,negatif
tidak ada pak,tidak pak,positif
"Tidak ada saran, karena Gurunya sangat baik hati dan sabar",tidak saran guru sangat baik hati sabar,positif
Mantap PAk,mantap pak,positif
Semua sudah baik,semua baik,positif
guru Pelajaran sangat baik dalam melakukan bimbingan belajar Pelajaran pemrograman Perangkat Bergerak,guru ajar sangat baik laku bimbing ajar ajar pemrograman perangkat gerak,positif
"Menurut saya apa yang di sampaikan bu di awal semester dan pengumpulan tugas yang sekarang tidak sesuai karena diawal hanya diminta membuat paper tanpa ketentuan apa pun tapi di akhir diminta referensi yang banyak selain itu ppt, poster dan animasi pun juga menyulitkan kami karena dikatakan di minggu akhir pengumpulan.",saya apa sampai bu awal semester kumpul tugas sekarang tidak sesuai awal minta buat paper tentu apa tapi akhir minta referensi banyak itu ppt poster animasi juga sulit karena kata di minggu akhir kumpul,negatif
seringsering berbuat baik dan intriopeksi dirinya masingmasing,seringsering buat baik intriopeksi diri masingmasing,negatif
sama sih bu,sama sih bu,positif
"Ditingkatkan gaya mengajarnya, kearah yang interaktif agar Siswa kelas pagi dapat lebihh memperhatikan",tingkat gaya ajar arah interaktif siswa kelas pagi lebihh perhati,negatif
lebih tanggap terhadap anak yang belum bisa mengerjakan,lebih tanggap anak belum kerja,negatif
bu terbaik,bu baik,positif
"terkadang saat pembelajaran, penjelasan materi berlangsung terlalu cepat",terkadang ajar jelas materi langsung terlalu cepat,negatif
"Terima kasih sudah membimbing kami selama satu semester, Bu.",terima kasih bimbing lama satu semester bu,positif
pak asik,pak asik,positif
tetap semangat bu guru untuk mengajar kita sebagai Siswa,tetap semangat bu guru ajar bagai siswa,positif
Sangat baik saat memberikan materi,sangat baik beri materi,positif
Semangat selalu pak SIPLHOO! :),semangat selalu pak siplhoo,positif
tugas kurang jelas,tugas kurang jelas,positif
Semoga kedepannya semakin baik lagi,moga depan makin baik,positif
Terima kasih dengan semua yang sudah di ajarkan sehat selalu dan bertambah rezekinya,terima kasih semua sudah ajar sehat selalu tambah rezeki,positif
semoga ibu tidak lupa untuk mengupload materi Pelajaran dan tugas. karena ibu terkadang lupa untuk mengupload materi Pelajaran dan mengupload tempat untuk mengumpulkan tugas di elearning dan semoga ibu tidak pelit nilai,moga ibu tidak lupa mengupload materi ajar tugas ibu terkadang lupa mengupload materi ajar mengupload tempat kumpul tugas elearning moga ibu tidak pelit nilai,negatif
kaib,kaib,positif
semoga lebih baik lagi kedepannya dalam pembelajaran,moga lebih baik depan ajar,positif
"Tidak ada, Pak guru the best",tidak pak guru the best,positif
bentuk soalnya diperbanyak buu,bentuk soal banyak buu,positif
Aman,aman,positif
kedepan nya di perjelas matematika nya,depan nya jelas matematika nya,negatif
"cara mengajar pak mudah dipahami dan jika saya ada kebingungan dimapel basis data langsung tanya ke pak dan dijawab dengan baik juga, terima kasih pak",cara ajar pak mudah paham jika ada bingung dimapel basis data langsung tanya pak jawab baik terima kasih pak,positif
Susah,susah,negatif
Kereen,kereen,positif
sangat baikk,sangat baikk,positif
semangat,semangat,positif
"Saran dari saya, semoga bapak/ibu dapat memperpanjang batas waktu pengumpulan tugas, sehingga kami tidak terlalu terbebani dan dapat mengerjakannya dengan maksimal",saran saya moga bapak ibu panjang batas waktu kumpul tugas kami tidak terlalu beban dapat kerja maksimal,negatif
terkait untuk penyampaian materi.untuk materi rumit di mohon untuk disampaikan pelanpelan,kait sampai materi materi rumit mohon sampai pelanpelan,negatif
"metode saat menyampaikan materi dapat di improve menggunakan media power point, karena media yang dipakai langsung menunjuk ke halaman pada ebook menggunakan cursor (full berbahasa inggris) sehingga kurang dapat dipahami oleh siswa",metode sampai materi di improve guna media power point media pakai langsung tunjuk halaman ebook guna cursor full bahasa inggris kurang paham siswa,negatif
Tolong pak kalau praktikum dikelas jangan cepat pak bukan karena otak Siswa lemot pak tapi tidak semua Siswa memiliki device laptop yg mumpuni pak termasuk saya pak laptop saya sudah 6 tahun usianya kadang suka lemot tanpa sebab pak mohon lah pengertiannya pak,pak kalau praktikum kelas jangan cepat pak bukan otak siswa lot pak tidak semua siswa milik device laptop yg mumpuni pak masuk pak laptop sudah tahun usia kadang suka lot sebab pak mohon lah erti pak,negatif
pemberian materi pendalaman bab akan materi yang disampaikan untuk setiap pertemuan,beri materi dalam bab materi sampai tiap temu,negatif
good pak,good pak,positif
Untuk sementara ini secara keseluruhan menyenangkan dan saya dapat menerima materi dari guru dengan baik,sementara cara seluruh senang saya terima materi guru baik,positif
"sudah baik,semoga bisa lebih baik lagi",baik moga lebih baik,positif
"Tida ada, hanya lebih ke pembelajaran dilaksanakan secara offline. Terimakasih bu",tida hanya lebih ajar laksana offline terimakasih bu,negatif
semoga pelajarannya lebih gampang lagi,moga ajar lebih gampang,negatif
Mungkin bisa ditambah dengan pdf atau ppt pak. karena beberapa yang dijelasin bapak terlalu cepat untuk ditulis,mungkin tambah pdf ppt pak beberapa dijelasin bapak terlalu cepat tulis,negatif
"berikan kesempatan interaktif saat pembelajaran, bukan pertanyaan pada akhir.",ikan sempat interaktif ajar bukan tanya akhir,negatif
Tidak ada penyampaian nilai pada tengah semester,tidak sampai nilai tengah semester,negatif
semoga lebih fleksibel dengan Siswa,moga lebih fleksibel siswa,negatif
Sudah sangat baik. Hanya saja kurang interaksi dengan Siswa (pembelajaran online). Terimakasih,sangat baik saja kurang interaksi siswa ajar online terimakasih,negatif
"Banyaknya jam kosong,jika memungkinkan digantikan dengan guru lain sesuai kekmampuan untuk menggantikan sementara di hari tersebut saja.",banyak jam kosong mungkin ganti guru sesuai kekmampuan ganti di hari sebut,negatif
Sipp dah sipp,sipp dah sipp,positif
materi pembalajarannya sangat banyak dengan waktu yang singkat mungkin bisa di pecah lagi untuk Pelajaran statistika. mungkin perlu juga di beri praktik mengenai statistika,materi pembalajarannya sangat banyak waktu singkat mungkin di pecah untuk ajar statistika mungkin perlu di beri praktik kena statistika,negatif
"Untuk materi yang disampaikan sangat jelas, sebaiknya bisa selalu seperti ini sampai kedepannya",materi sampai sangat jelas baik selalu ini depan,positif
bisa lebih baik,lebih baik,positif
Semoga kedepannya bisa lebih baik lagi ibu terimakasih 1 semester ini sukses selalu.,moga depan lebih baik ibu terimakasih semester sukses selalu,positif
Terbaik dan seru materinya,baik seru materi,positif
"Mungkin dalam Pelajaran kelas offline, jika tidak bisa dilaksanakan atau kendala, sebaiknya bisa dilaksanakan dengan kelas online agar bisa mengejar waktu dan materi yang akan diberikan",mungkin ajar kelas offline tidak laksana kendala baik laksana kelas online bisa kejar waktu materi akan beri,negatif
sudah baik dalam menyampaikan materi,baik sampai materi,positif
Kurangnya internet merupakan pemicu pembelajaran,kurang internet rupa picu ajar,positif
"Terdapat guru yang tidak cocok dalam pekerjaannya akan tetapi masih dipekerjakan, hal ini membuat siasia Pelajaran yang diampu apalagi Pelajarannya menyangkut pembahasan metodologi dalam pembuatan proposal akhir",dapat guru tidak cocok kerja tetapi kerja ini buat siasia ajar ampu ajar sangkut bahas metodologi buat proposal akhir,negatif
cara mengajar sudah sangatt baik dan semoga terus dipertahankan,cara ajar sangatt baik moga terus tahan,positif
Sudah sangat baik dalam segala halnya,sangat baik segala hal,positif
mudah dipahami,mudah paham,positif
nay,nay,negatif
Udah bagus dalam menyampaikan materi dan di harapan untuk kedepannya bisa lebih baik lagi,udah bagus sampai materi di harap depan lebih baik,positif
jika ada Pelajaran jangan saat libur akhir pekan,ada ajar jangan libur akhir pekan,negatif
"terima kasih bu atas ilmu nya. mohon maaf dalam pehaman dan penugasan saya yang belum cukup baik. sedikit saran, mungkin bila Siswa bertanya melalui wa bisa diberi tanggapan bu. karena itu kami tanyakan dengan alasan memang kami tidak tahu dan ingin sungguhsungguh tahu",terima kasih bu atas ilmu nya mohon maaf ham tugas yang belum cukup baik sedikit saran mungkin bila siswa tanya lalu wa beri tanggap bu itu tanya alas memang tidak tahu ingin sungguhsungguh tahu,negatif
baik dalam penjelasan,baik jelas,positif
"lebih dievaluasi lagi, di semester ini beberapa guru kurang bisa menjelaskan materi dengan baik",lebih evaluasi di semester beberapa guru kurang jelas materi baik,negatif
Saran saya Bu kalo mengajar dengan cara berkomunikasi dengan Siswa nya supaya tidak bosan,saran bu kalo ajar cara komunikasi siswa nya tidak bosan,negatif
Pelajaran materi Jarkom saya rasa sangat baik,ajar materi jarkom rasa sangat baik,positif
materi yang berikan mudah dipahami oleh Siswa,materi ikan mudah paham siswa,positif
Love untuk Pak .,love pak,positif
"saran saya untuk Pelajaran statistika tugasnya banyak, ada kuis ada tugas besar kasian saya dan temanteman saya kewalahan dengan banyaknya tugas semoga kedepannya tidak seperti ini lagi. Dan untuk guru Pelajaran manajemen proses bisnis kalau dichat Siswa seharusnya dibalas karena balasan dari guru memberikan informasi kepada Siswa",saran ajar statistika tugas banyak kuis tugas besar kasi dan temanteman kewalahan banyak tugas moga depan tidak ini dan untuk guru ajar manajemen proses bisnis kalau dichat siswa balas balas guru beri informasi siswa,negatif
Terima kasih BU,terima kasih bu,positif
"Penyampaiannya mungkin bisa lebih jelas, karena tiba2 menggunakan dbeaver padahal sebelumnya belum pernah sama sekali diberitahu apknya maupun caranya. Setiap praktikum tidak mengerti",sampai mungkin lebih jelas tiba guna dbeaver padahal belum belum pernah sama sekali diberitahu apknya maupun cara praktikum tidak erti,negatif
Tidak ada saran soalnya guru bagus dan baik dalam mengajar yang membuat Siswa lebih aktif.,tidak saran soal guru bagus baik ajar buat siswa lebih aktif,positif
"Tidak ada, guru terbaik selama 1 semester saya di",tidak guru baik lama semester di,positif
Mungkin lebih banyak diajarkan secara praktik dibanding teori,mungkin lebih banyak ajar praktik banding teori,negatif
"Saran dari siswa, jika berkenan guru perlu menghadirkan variasi mengajar baru dengan memberikan isuisu relevan pada masa kini.",saran siswa kenan guru perlu hadir variasi ajar baru beri isuisu relevan masa kini,negatif
lebih di perbanyak offline dan sesuai jurusan biar ga campur,lebih banyak offline sesuai jurus biar ga campur,negatif
ibu guru dapat lebih pelan dalam menjelaskan materi dan memberikan kesempatan para siswa/i untuk menyerap ilmu yang diberikan.,ibu guru lebih pelan jelas materi beri sempat siswa i serap ilmu beri,negatif
penyampaian kurang bisa dimebgerti,sampai kurang dimebgerti,negatif
"semoga bu sehat selalu, dan terimakasih atas ilmunya untuk satu semester ini bu",moga bu sehat selalu terimakasih atas ilmu satu semester bu,positif
nihil,nihil,positif
Saran saya untuk Ibu pada saat menjelaskan jangan terlalu cepat dan misal para Siswa diberi waktu untuk menulis materi jangan terlalu cepat juga durasinya. Mungkin sekitar 10 menitan sudah cukup terima kasih,saran ibu saat jelas jangan terlalu cepat misal siswa beri waktu untuk tulis materi jangan terlalu cepat durasi mungkin menit cukup terima kasih,negatif
Snagst baik,snagst baik,positif
bapak keren beut,bapak keren beut,positif
sangat baik kalau mengajar :),sangat baik kalau ajar,positif
semoga bisa lebih di tingkatkan lagi,moga lebih tingkat,positif
gitu,gitu,positif
ditingkatkan lagi cara mengajarnya bu,tingkat cara ajar bu,positif
semoga pembelajaran berikutnya dapat lebih baik dan berjalan dengan lancar,moga ajar ikut lebih baik jalan lancar,positif
Bu is de best,bu is de best,positif
SEMOGA SEHAT SELALU PAK,moga sehat selalu pak,positif
"Tidak ada, bapak nya udah jago dalam statiska. Hanya saja kalau bikin soal UTS jangan susah2 pak :)",tidak bapak nya udah jago statiska saja kalau bikin soal uts jangan susah pak,positif
bu sangat sabar,bu sangat sabar,positif
semoga kedepanya bisa lebih baik lagi,moga depa lebih baik,positif
"Semoga tidak hybrid lagi, semoga pembelajarannya lebih baik lagi",moga tidak hybrid moga ajar lebih baik,negatif
"sudah baik,",baik,positif
Kereenn,kereenn,positif
Secara keseluruhan guru telah memberikan yang terbaik. Terimakasih telah memberi ilmu pada semester ini.,seluruh guru beri baik terimakasih beri ilmu semester,positif
Selama di kelas agak susah mendengar apa yang dikatakan guru dan banyak teman sekelas saya menyarankan untuk menggunakan speaker mini karena suara guru yang menyampaikan materi di kelas tidak terdengar di belakang.,lama kelas susah dengar apa kata guru banyak teman kelas saran guna speaker mini suara guru sampai materi kelas tidak dengar belakang,negatif
"Sering Tatap muka bu dalam pembelajaran nya, agar lebih mudah untuk di pahami. Terimakasih",sering tatap muka bu ajar nya lebih mudah di paham terimakasih,negatif
"Alhamdulillah sudah cukup baik, mungkin kedepannya bisa diadakan secara offline agar para Siswa bisa lebih disiplin",alhamdulillah cukup baik mungkin depan ada offline para siswa lebih disiplin,negatif
Materinya jangan terlalu banyak dalam satu kali pertemuan,materi jangan terlalu banyak satu kali temu,negatif
Tetap enjoy bu,tetap enjoy bu,positif
"Untuk kedepannya mungkin saat bapak menjelaskan materi bisa lebih pelan dan lebih terperinci. Terima kasih bapak, atas materi dan bimbingannya di satu semester ini.",depan mungkin bapak jelas materi lebih pelan lebih perinci terima kasih bapak atas materi bimbing satu semester,negatif
"Mungkin kalau kasih info jika kelas ditiadakan jangan dadakan, karena banyak temanteman yang rumahnya jauh buat datang ke sekolah tapi tidak ada Pelajaran dan akhirnya balik lagi tanpa dapat apa apa",mungkin kalau kasih info kelas tiada jangan dada banyak temanteman rumah jauh buat datang sekolah tidak ajar akhir balik tanpa apa apa,negatif
sudah sangat baik teruskan hehe,sangat baik terus hehe,positif
Terimakasih sudah membimbing selama 1 semester pak.,terimakasih bimbing lama semester pak,positif
semoga sukses kedepanya,moga sukses depa,positif
Saran agar tidak banyak memberikan tugas untuk siswa. Terima Kasih.,saran tidak banyak beri tugas siswa terima kasih,negatif
"makasii bu, materinya kerennn",makasii bu materi kerennn,positif
"mohon saat menjelaskan jangan terlalu cepat, karena terkadang ada kendala jaringan, jadi kurang jelas",mohon jelas jangan terlalu cepat terkadang kendala jaring jadi kurang jelas,negatif
Kalau udah mau akhir Materi minimal masuk lah,kalau udah mau akhir materi minimal masuk lah,negatif
Saran saya untuk guru pengampu yakni tetap melakukan pembelajaran dengan baik,saran untuk guru ampu tetap laku ajar baik,positif
Siswa tidak bisa menguasai materi karena pengajaran kurang,siswa tidak kuasa materi ajar kurang,negatif
Lebih ditingkatkan lagi menjadi guru yang lebih baik lagi,lebih tingkat jadi guru lebih baik,positif
jangan sering berpatok pada teori dasar,jangan sering patok teori dasar,negatif
Tetap semangat terus pak.,tetap semangat terus pak,positif
tugas akhirnya sangat menguras biaya banyak pak,tugas akhir sangat uras biaya banyak pak,negatif
Sudah bagus metode pembelajaran nya,bagus metode ajar nya,positif
semoga materi yang diberikan kedepannya mudah untuk di pahami terkasang ada materi yang sulit untuk di pahami,moga materi beri depan mudah di paham kasang materi sulit di paham,negatif
ditambahkan tugas latihan soal agar Siswa lebih mendalami materi,tambah tugas latih soal siswa lebih dalam materi,negatif
Mengajar secara interaksi langsung bukan hanya record an zoom saja. pemberian materi sangat kurang tapi tugas sangat banyak,ajar interaksi langsung bukan record an zoom beri materi sangat kurang tugas sangat banyak,negatif
Ditambah materi pembelajaran,tambah materi ajar,negatif
Sudah cukup baik dalam menjelaskan materi,cukup baik jelas materi,positif
keren,keren,positif
"semuanya baik, namun untuk sebagian praktikum terkadang tidak bisa digunakan dengan maksimal, sehingga menggunakan aplikasi pada laptop.",semua baik untuk bagi praktikum terkadang tidak guna maksimal guna aplikasi laptop,negatif
"untuk mengumpulkan tugas di elearning berkata perwalian tapi saat sudah di kumpulkan anggota yang di wakilkan tidak otomatis submit , jadi kami Siswa bingung dan was was melihat tugas yang tiba tiba overdue",kumpul tugas elearning kata wali saat di kumpul anggota di wakil tidak otomatis submit jadi siswa bingung was was lihat tugas tiba tiba overdue,negatif
cukkup baik,cukkup baik,positif
Kalau bisa lebih sering masuk terima kasih,kalau lebih sering masuk terima kasih,negatif
Untuk saran nyaa jangan terlalu sering untuk meniadakan kelas menjadi kelas kosong pelajaran statistika asyik,saran nyaa jangan terlalu sering tiada kelas jadi kelas kosong ajar statistika asyik,negatif
Semangat bu,semangat bu,positif
Mungkin kedepannya bisa lebih baik lagi dalam penyampaian materi dan penguasaan materi nya,mungkin depan lebih baik dalam sampai materi kuasa materi nya,negatif
Sebaiknya diberi materi terlebih dahulu baru latihan soal,baik beri materi lebih baru latih soal,negatif
Sudha baik,sudha baik,positif
Materi sedikit sulit di pahami,materi sedikit sulit paham,negatif
Bu guru sudah memenuhi semua aspek dengan sangat baik.,bu guru penuh semua aspek sangat baik,positif
saran tidak ada sudah bagus,saran tidak sudah bagus,positif
Semoga bisa bertemu di semester depan lagi. Terimakasih Bu,moga temu semester depan terimakasih bu,positif
"Guru harus mampu menjelaskan terkait hal yang akan di sampaikan kepada Siswa nya, tidak dengan Siswa yang mencari jawaban dengan sendirinya",guru mampu jelas kait di sampai siswa nya tidak siswa yang cari jawab sendiri,negatif
makasih ibuuu,makasih ibuuu,positif
semakin semangat,makin semangat,positif
Saran agar bisa offline sehingga materi yang disampaikan lebih maksimal.,saran bisa offline materi sampai lebih maksimal,negatif
Tingkatkan selalu,tingkat selalu,negatif
Bu sudah memberikan materi sesuai dengan RPS serta penjelasan yang mudah dipahami kemudian memberikan contoh kasus di kehidupan nyata. Dan kalau UAS/UTS tugasnya tugas besar yang mana melakukan analisis dimana kita bisa menggunakan materi yang telah disampaikan agar di aplikasikan di kehidupan nyata dan menjadikan solusi atas suatu permasalahan di masyarakat,bu beri materi sesuai rps jelas mudah paham kemudian beri contoh kasus hidup nyata kalau uas uts tugas tugas besar mana laku analisis kita guna materi telah sampai aplikasi hidup nyata jadi solusi atas suatu masalah di masyarakat,negatif
"mohon maaf bpk/ibu guru mohon nilaiku dtingkatkan .soalnya saya sudah semangat Pelajarannya,nanti kalo nilaiku jelek auto menurun semangatku untuk belajar lagi,cukup sekian dari saya ada kurang lebihnya mohon maaf wassalamualaikum/wrb",mohon maaf bpk ibu guru mohon nilai dtingkatkan soal sudah semangat ajar kalo nilai jelek auto turun semangat ajar cukup sekian saya kurang lebih mohon maaf wassalamualaikum wrb,negatif
"Tetap menjadi guru favorit sayaa, terimakasih banyak bu sudah sabar dan baik dalam memberikan pembelajaran.",tetap jadi guru favorit sayaa terimakasih banyak bu sabar baik beri ajar,positif
Semoga lebih baik lagi kedepannya.,moga lebih baik depan,positif
lebih ditingkatkan lagi untuk pemberian materi,lebih tingkat untuk beri materi,negatif
Membuat kelas menjadi interaktif dan menyenangkan.,buat kelas jadi interaktif senang,positif
lebih sering lagi interaksi dengan Siswa,lebih sering interaksi siswa,negatif
"belum ada saran, guru sangat baik dalam mengajari siswa.",belum saran guru sangat baik ajar siswa,positif
semoga materi yang disampaikan selalu menjadi pengantar terbaik untuk Tugas Akhir Siswa,moga materi sampai selalu jadi antar baik tugas akhir siswa,positif
"Lebih banyak meme nya lagi pak, biar pembelajaraannya makin seru.",lebih banyak meme nya pak biar pembelajaraannya makin seru,positif
tugas besar seharusnya dari semua apa yang sudah dipelajari dalam Pelajaran tetapi guru memberikan tugas besar yang sangat kurang sesuai dengan materi pembelajaran yang diberikan,tugas besar dari semua apa sudah ajar ajar guru beri tugas besar sangat kurang sesuai materi ajar beri,negatif
Sangat baik sangat ingin sekali belajar dengan bapak lagi,sangat baik sangat sekali ajar bapak,positif
terima kasih atas seluruh proses pembelajaran yang berjalan dengan baik,terima kasih atas seluruh proses ajar jalan baik,positif
kekurangannya pedjawalan tugas di elearning perwakilan tapi saat di cek 1 tidak tercentang otomatis seperti Pelajaran psi,kurang pedjawalan tugas elearning wakil saat cek tidak centang otomatis ajar psi,negatif
Sudah baik,baik,positif
materi yang diberikan mudah dipahami oleh Siswa,materi beri mudah paham siswa,positif
"Pemberian saran sangat baik dan mudah dipahami, semoga tetap dapat dipertahankan",beri saran sangat baik mudah paham moga tetap tahan,positif
Untuk deadline tugas jangan di hari itu juga kalau bisa diberi waktu yang lebih,deadline tugas jangan hari juga kalau beri waktu lebih,negatif
keseluruhan sudah baik,seluruh baik,positif
"fokus saja pada satu bidang keilmuan, soalnya waktu responsi sangat tidak efektif",fokus pada satu bidang ilmu soal waktu responsi sangat tidak efektif,positif
Bagi saya Bu sudah cukup sangat baik dalam penyampaian materi atapun saat memberikan tugas,saya bu cukup sangat baik sampai materi atapun beri tugas,positif
Semangat bu menjalani semua aktivitas semoga rezekinya dipermudahkan,semangat bu jalan semua aktivitas moga rezeki mudah,positif
mungkin untuk kedepannya untuk materi bsa di share dulu di e learning biar kita Siswa bsa mengaksesnya tanpa hatus melihat dr zoom saja,mungkin depan materi bsa share dulu e learning biar siswa bsa akses hatus lihat dr zoom,negatif
Sangat baik,sangat baik,positif
Saran saya tetap menjadi guru yang humoris dan mencairkan suasana kelas,saran tetap jadi guru humoris cair suasana kelas,positif
Tidak ada keluhan,tidak keluh,positif
untuk pembelajaran sudah sangat baik dan serius,ajar sangat baik serius,positif
Lanjutkan,lanjut,positif
semangat mengajarnya bu,semangat ajar bu,positif
sudah cukup baik dalam memberi pembelajaran,cukup baik beri ajar,positif
tidak ada saran karena guru sudah memberikan yang terbaik untuk Siswa,tidak saran guru beri baik siswa,positif
"Sudah memberi materi dengan baik, tetapi ada kekurangan dalam penerangan tugas tugas yang dikerjakan",beri materi baik ada kurang terang tugas tugas kerja,negatif
Lebih baik lagi kedepannya,lebih baik depan,positif
Kedepannya semakin ditingkatkan proses belajar mengajarnya,depan makin tingkat proses ajar ajar,positif
perbanyak interaksi dengan Siswa,banyak interaksi siswa,negatif
"lebih sering melakukan pembahasan soal, terlebih setelah quiz dan jawaban kuiz Siswa dapat dibagikan sehingga bisa dipelajari lagi.",lebih sering laku bahas soal lebih quiz jawab kuiz siswa bagi bisa ajar,negatif
"sebaiknya lebih dispesifikkan lagi setiap jurusannya, karena kadang tema yang diberikan oleh pemateri hampir tidak ada kaitannya dengan jurusan.",baik lebih spesifik tiap jurus kadang tema beri materi hampir tidak kait jurus,negatif
