Survey,clean_text,Label
Guru memberikan materi dengan jelas dan efisien sehingga memudahkan Siswa dalam memahami materi,guru beri materi jelas efisien mudah siswa paham materi,positif
"Sering telat ngasih informasi bila ada jamkost, saran saya bila ada jamkost di kabarkan 1 jam sebelum pelajaran. Selebihnya pak sngat ramah sama Siswa",sering telat ngasih informasi bila jamkost saran bila jamkost kabar jam belum ajar lebih pak sngat ramah sama siswa,negatif
"terimakasih bu, selama proses pembelajaran berlangsung ibu sudah menjelaskan materi dengan baik dan dapat diterima dengan mudah",terimakasih bu lama proses ajar langsung ibu jelas materi baik dapat terima mudah,positif
all of good,all of good,positif
Gajelass ini,gajelass,negatif
lebih sering menerangkan materi dan memberikan teori terlebih dahulu sebelum pemberian tugas,lebih sering terang materi beri teori lebih belum beri tugas,negatif
"Saya suka dengan sikap bapak dalam melakukan pengajaran, namun bimbingan dan pendekatan ke Siswa kurang",suka sikap bapak laku ajar bimbing dekat siswa kurang,negatif
"Lebih diperbanyak komunikasi dengan siswa, dan membuat suasana pembelajaran supaya tidak bosan & ngantuk",lebih banyak komunikasi siswa buat suasana ajar tidak bosan ngantuk,negatif
sebaik melakukan pendekatan secara pribadi ke Siswa,baik laku dekat pribadi siswa,negatif
"sudah cukup , karena membantu kebingungan Siswa",cukup bantu bingung siswa,positif
Bu tolong beri PR pada bab membuat gambar grafikgrafik agar saya lebih paham.,bu beri pr bab buat gambar grafikgrafik saya lebih paham,negatif
Saran diakhir semester menjelang tubes penyampaian tubes diperjelas,saran akhir semester jelang tubes sampai tubes jelas,negatif
sehat selalu pak,sehat selalu pak,positif
kelasnya terlalu pagi jadi kami sering terlambat karena jalan macet dll,kelas terlalu pagi jadi sering lambat jalan macet,negatif
Sudah baik dalam memberikan materi,baik beri materi,positif
Semoga ditingkatkan,moga tingkat,positif
Mantap pak lanjutkan,mantap pak lanjut,positif
terima kasih pak,terima kasih pak,positif
Kedepannya bisa lebih sering offline,depan lebih sering offline,negatif
Suara lebih keras,suara lebih keras,negatif
"Latihan soal kurang banyak, terlalu banyak materi dan sulit memahami. Terimakasih",latih soal kurang banyak terlalu banyak materi sulit paham terimakasih,negatif
Terimakasih untuk pak telah memberikan materi kapita selekta dengan baik. Semoga kedepanya bisa menyesuaikan jadwal rps dan bisa lebih sering offline.,terimakasih pak beri materi kapita selekta baik moga depa sesuai jadwal rps bisa lebih sering offline,positif
cara mengajar anda sangat bagus,cara ajar sangat bagus,positif
Guru favorit dan konsisten dalam mengajar kami sekaligus tidak pernah bosan dikelas.,guru favorit konsisten ajar sekaligus tidak pernah bosan kelas,positif
Mohon bimbingannya,mohon bimbing,positif
"semoga kedepaannya on time masuk kelas, guru terseru semoga akan tetap seperti itu",moga depa on time masuk kelas guru seru moga tetap itu,negatif
sudah cukup baik penyampaian materinya,cukup baik sampai materi,positif
Semangat meningkatkan kinerja,semangat tingkat kerja,positif
"Tidak ada, salah satu guru terbaik versi saya selama 1 semester saya",tidak salah satu guru baik versi lama semester,positif
sudah bagus sekali,bagus sekali,positif
menjelaskan materi secara rinci dan asisten Gurunya yg asik,jelas materi rinci asisten guru yg asik,positif
mohon izin untuk Lebih di jelaskan lagi materinya dengan mendalam,mohon izin lebih jelas materi dalam,negatif
Suaranya dikeraskan lagi,suara keras,negatif
"Sangat baik, detail dalam menjelaskan",sangat baik detail jelas,positif
Pertahankan kerja bagusnya,tahan kerja bagus,positif
pertahankan,tahan,positif
"dalam menjelaskan materi sudah baik, namun untuk pemilihan warna spidol perlu diperhatikan lagi terkadang tidak terlihat",jelas materi baik untuk pilih warna spidol perlu perhati terkadang tidak lihat,negatif
Tolong kalau menjelaskan materi secara runtut,kalau jelas materi runtut,negatif
Be better,be better,positif
mungkin bisa lebih detail dan tidak terburu dalam penggatian materi,mungkin lebih detail tidak buru penggatian materi,negatif
Sejauh ini sudah baik,jauh sudah baik,positif
menjadi lebih menyenangkan,jadi lebih senang,positif
Sudah sangat baik dalam mengajar semoga sehat selalu,sangat baik ajar moga sehat selalu,positif
Untuk guru tidak tetap saya rasa ada beberapa yg penyampaiannya belum bisa dibawakan dengan baik apalagi jika kelas yg diadakan lewat zoom (online) dimana kendala jaringan pun ada.,guru tidak tetap rasa beberapa yg sampai belum bawa baik jika kelas yg ada lewat zoom online kendala jaring ada,negatif
kalau ngajar yg semangat pak,kalau ngajar yg semangat pak,positif
Semoga kedepanya lebih baik lagi,moga depa lebih baik,positif
Sehat selalu pak perdana,sehat selalu pak perdana,positif
jumlah slide dalam materi ppt terlalu banyak sehingga kami hanya fokus di awal penyampaian materi saja. Mungkin bisa dengan diberikan ice breaking berupa quiziz materi atau lainnya untuk mengembalikan konsentrasi kami lagi hehe,jumlah slide materi ppt terlalu banyak fokus awal sampai materi mungkin dengan beri ice breaking upa quiziz materi lain kembali konsentrasi kami lagi hehe,negatif
leih baik dalam menyampaikan materi,leih baik sampai materi,negatif
saya kurang memahami banyak materi,kurang paham banyak materi,positif
agar tidak zoom lgi,tidak zoom lgi,negatif
Bisa bagus,bagus,positif
Boleeh2 paak,boleeh paak,positif
"Tidak ada saran, menurut saya sudah cukup",tidak saran saya cukup,positif
"Bu guru paling favorit ¿¿¿¿, seru banget diajar bu dari mapel akuntansi sampai manajemen keuangan. materi yang disampaikan juga mudah dipahami, kalau jelasin rumus hitungan mudah banget buat di pahami jadi sukaaa belajar keuangan",bu guru paling favorit seru banget ajar bu mapel akuntansi manajemen uang materi sampai mudah paham kalau jelasin rumus hitung mudah banget buat paham jadi sukaaa ajar uang,positif
Cukup baik tidak ada saran,cukup baik tidak saran,positif
Materinya lebih di mudah dipahami lagi. sedikit tidak apa asalakan dapat dipahami kita.,materi lebih mudah paham sedikit tidak apa asalakan paham,negatif
Pembelajaran gak ngebosenin,ajar gak ngebosenin,positif
semoga konsisten terus buk,moga konsisten terus buk,positif
Semoga kedepannya ada kelas offline,moga depan kelas offline,negatif
Agar dapa melaksanakan pembelajaran tatap muka bersama Bu harum,dapa laksana ajar tatap muka sama bu harum,negatif
Penyampaian materi yang sangat menarik,sampai materi sangat tarik,positif
"sudah baik bu pengajarannya, tapi mohon untuk lebih menguasai lagi dalam penyampaian materinya",baik bu ajar mohon lebih kuasa dalam sampai materi,negatif
"Tidak ada, dan sudah baik",tidak dan baik,positif
Saran : Semoga bisa lebih sabar pada semua Siswa,saran moga lebih sabar semua siswa,negatif
sebaiknya melakukan pendekatan secara pribadi karena ada beberapa anak yang kyurang mengerti,baik laku dekat pribadi ada beberapa anak kyurang erti,negatif
"terimakasih bapak atas pengajaran yang maksimal, semoga ilmu yang diberikan dapat memberikan manfaat bagi Siswa dan semoga bapak mendapatkan balasan lebih atas kebaikan yang telah diberi kepada kita oleh tuhan yang maha esa",terimakasih bapak atas ajar maksimal moga ilmu beri beri manfaat siswa moga bapak dapat balas lebih atas baik telah beri kita tuhan maha esa,positif
terima kasih pak,terima kasih pak,positif
Semangat menjalani hari baru ibu semoga selalu bersemangat untuk tetap mengajar..,semangat jalan hari baru ibu moga selalu semangat tetap ajar,positif
sudah top,top,positif
Sangat baik untuk menjelaskan pada pelajaran,sangat baik jelas ajar,positif
terimakasih banyak,terimakasih banyak,positif
saya suka dengan metode pembelajaran yang lebih interaktif untuk meningkatkan motivasi para Siswa,suka metode ajar lebih interaktif tingkat motivasi siswa,positif
Mungkin lebih diperbanyak lagi waktu dalam mengajar supaya tercipta hubungan yang lebih erat dengan siswa. Tidak hanya diberi tugas saja lalu kelas kosong.,mungkin lebih banyak waktu ajar cipta hubung lebih erat siswa tidak beri tugas lalu kelas kosong,negatif
"Terima kasih bapak telah memberikan saya ilmu yang bermanfaat dan bukan sekedar nilai.Terimakasih atas motivasi motivasi yang selalu bapak berikan. Cara mengajar bapak sudah baik Menurut saya bapak adalah guru yang menarik dapat berbaur dengan Siswa seakan akan menjadi teman, jadi kami dapat dengan mudah menerima pelajaran dari bapak. Terima kasih pak. Pak cara mengajarnya selow tapi sangat disiplin dan mengharapkan Siswa yang diajarkan paham, membawa siswanya belajar dengan enjoy dan mengikuti arus yang mengalir, bapak juga memancing semangat kompetisi Siswa disaat belajar,",terima kasih bapak beri ilmu manfaat bukan dar nilai terimakasih atas motivasi motivasi selalu bapak ikan cara ajar bapak baik saya bapak guru tarik baur siswa akan jadi teman jadi dapat mudah terima ajar bapak terima kasih pak pak cara ajar selow sangat disiplin harap siswa ajar paham bawa siswa ajar enjoy ikut arus alir bapak pancing semangat kompetisi siswa saat ajar,positif
"Tidak ada saran, proses belajar mengajar telah berjalan dengan baik",tidak saran proses ajar ajar jalan baik,positif
Sudah cukup baik namun lebih bagus jika dalam materi diberikan latihan soal juga,cukup baik lebih bagus dalam materi beri latih soal,negatif
"Dari saya, Ibu guru sudah menggunakan sistem pembelajaran yang baru dan efisien, sehingga penyampaian materi dapat mudah dipahami.",saya ibu guru guna sistem ajar baru efisien sampai materi mudah paham,positif
Semoga menjadi guru yang terus membimbing baik,moga jadi guru terus bimbing baik,positif
mungkin perlu secara langsung dalam penyampaian materi,mungkin perlu langsung sampai materi,negatif
Mohon untuk lebih banyak materi coding dan modul yang baik,mohon lebih banyak materi coding modul baik,negatif
Semangat menjalani hari baru ibu semoga selalu bersemangat untuk untuk mengajar..,semangat jalan hari baru ibu moga selalu semangat untuk ajar,positif
Mungkin untuk praktikum lebih banyak menggunakan alat bukan software,mungkin praktikum lebih banyak guna alat bukan software,negatif
Sangat baik dalam menayampaikan informasi dan juga memberika arahan,sangat baik menayampaikan informasi juga memberika arah,positif
"Ibu Guru sekiranya lebih pelanpelan dalam menjelaskan materi Pelajaran, sehingga saya dapat memahami satu persatu materi dengan baik terimakasih",ibu guru sekira lebih pelanpelan jelas materi ajar saya paham satu satu materi baik terimakasih,negatif
Semoga semster depan lebih ditingkatkan lagi,moga semster depan lebih tingkat,positif
"Detail dalam menjelaskan, sabar & kereen cara mengajarnya",detail jelas sabar kereen cara ajar,positif
jangan ngasih tugas yg berat2 pak,jangan ngasih tugas yg berat pak,negatif
"Pada saat melakukan pemberian materi ada baiknya untuk make sure siswanya paham atau tidak, dan diberi jeda tanya jawab dengan waktu yang cukup. Karena matematika tidak semudah itu untuk dicerna bagi saya, jadi ada baiknya untuk melakukan hal itu tadi",saat laku beri materi baik make sure siswa paham tidak beri jeda tanya jawab waktu cukup matematika tidak mudah cerna saya jadi baik untuk laku itu tadi,negatif
Lebih sering mengerjakan codingan program bersama agar bisa memahami algoritma saat mengcoding,lebih sering kerja codingan program sama bisa paham algoritma mengcoding,negatif
menghadirkan variasi pembelajaran baru,hadir variasi ajar baru,negatif
untuk lebih kencang lagi suaranya saat menjelaskan,lebih kencang suara jelas,negatif
guru sudah sangat baik dalam memberikan contoh dan materi,guru sangat baik beri contoh materi,positif
semoga lebih sering hadir dalam kelas,moga lebih sering hadir kelas,negatif
"Saran saya, jika berkenan guru perlu menghadirkan variasi mengajar baru dengan memberikan isuisu relevan pada masa kini.",saran jika kenan guru perlu hadir variasi ajar baru beri isuisu relevan masa kini,negatif
tetap semangat terus pak,tetap semangat terus pak,positif
Kasih sesi debat pak,kasih sesi debat pak,positif
Semoga kedepannya lebih baik,moga depan lebih baik,positif
"Masya Allah pak pengajaran nya no debat, cuman suara bapa kadang tidak terdengar dengan jelas pak terus terang itu saja si yang biasa nya nge distrek saya",masya allah pak ajar nya no debat cuman suara bapa kadang tidak dengar jelas pak terus terang saja si biasa nya nge distrek,negatif
TERIMA KASIH BU ATAS ILMUNYA,terima kasih bu atas ilmu,positif
"semua nya sangat berjalan dengan baik, baik dari penyampaian, pemberian tugas, dan penilaian",semua nya sangat jalan baik baik sampai beri tugas nilai,positif
Pembelajarannya asik dan seru,ajar asik seru,positif
"Guru yang memberikan pengajaran yang baik, bu memberikan pemahaman yang tidak didapatkan dari guru probabilitas sebelumnya",guru beri ajar baik bu beri paham tidak dapat guru probabilitas belum,positif
Ga ada.,ga,positif
Guru Metopen yang sangat mudah berbaur dengan anak muda bagaikan seorang ayah. Penjelasan yang disampaikan sangat mudah dipahami. Hanya saja judul proposal saya ditolak karena Jam ditempuh total yang tidak mencukupi,guru metopen sangat mudah baur anak muda bagai orang ayah jelas sampai sangat mudah paham saja judul proposal tolak jam tempuh total tidak cukup,positif
Pembawaan Pelajaran sudah sesuai dan metode pengajaran sudah sangat baik,bawa ajar sesuai metode ajar sangat baik,positif
Out of topic,out of topic,negatif
mungkin lebih bisa merata untuk Siswa yang diajak komunikasi dan ditunjuk untuk melakukan pembelajaran,mungkin lebih rata siswa ajak komunikasi tunjuk laku ajar,negatif
Baik dalam mengajar...meski suara agak gak jelas,baik ajar meski suara gak jelas,positif
Untuk pemberian materi jangan mendadak dan untuk tugas saya harap kriterisnya tidak terlalu membebani.,beri materi jangan dadak untuk tugas harap kriterisnya tidak terlalu beban,negatif
Tidah ada sudah baik,tidah sudah baik,positif
lebih baik,lebih baik,positif
lebih ditingkatkan lagi skillnya,lebih tingkat skillnya,positif
semoga nilai saya diberi yg baik aminn,moga nilai beri yg baik aminn,positif
sangat baik saat mengajarkan money management,sangat baik ajar money management,positif
Untuk penyampaian materi ke depannya diharapkan intonasinya lebih pelanpelan agar mudah dimengerti dan mudah untuk mengikuti materi,sampai materi depan harap intonasi lebih pelanpelan mudah erti mudah ikut materi,negatif
Lebih Baik lagi,lebih baik,positif
"Tidak ada saran dari saya. Bu sudah sangat baik ketika mengajar kami, di mulai dari cara menerangkan materi yang mudah di pahami, dan penyediaan materi di e learning yang lengkap. Saya ucapkan terima kasih untuk ibu .",tidak saran bu sangat baik ajar mulai cara terang materi mudah paham sedia materi di e learning lengkap saya ucap terima kasih ibu,positif
Kelas offline,kelas offline,negatif
secara keseluruhan penyampaian materi yang diberikan sangat baik,seluruh sampai materi beri sangat baik,positif
"Untuk kedepannya mungkin dalam proses pembelajaran penyampaian materi lebih rinci, jelas, dan terstruktur",depan mungkin proses ajar sampai materi lebih rinci jelas struktur,negatif
Untuk Materinya di sampaikan mantap,materi sampai mantap,positif
"Saran untuk guru pengampu menyamaratakan setiap siswa, mengutamakan dan memfokuskan secara lebih kapada Siswa yang dianggap kurang, dan harapannya lebih baik lagi dari yang sudah diterapkan",saran guru ampu menyamaratakan siswa utama fokus lebih kapada siswa anggap kurang harap lebih baik dari sudah terap,negatif
Terima kasih bu,terima kasih bu,positif
semangatt untuk kedepan nya,semangatt depan nya,positif
mungkin perlu disesuaikan dengan bidang yang dikuasai,mungkin perlu sesuai bidang asai,negatif
lebih sabar lagi dalam mengajar,lebih sabar dalam ajar,negatif
mengaplikasikan metode pembelajaran yang aktif agar pembelajaran tidak terkesan monoton dan membuat Siswa tidak mengantuk saat dikelas,aplikasi metode ajar aktif ajar tidak kes monoton buat siswa tidak antuk kelas,negatif
memberikan pembahasan dari tugas agar bisa mengerti letak kesalahan,beri bahas tugas bisa erti letak salah,positif
"Saran dari saya, Bapak Guru sekiranya lebih pelanpelan dalam memberikan materi Pelajaran, sehingga kami dapat memahami satu persatu materi dengan baik.",saran saya bapak guru sekira lebih pelanpelan beri materi ajar kami paham satu satu materi baik,negatif
semoga lebih baik kedepannya dalam mengajar,moga lebih baik depan ajar,positif
Terimakasih bapak telah memberikan materi Pengantar RPL dengan sangat baik. Saya sebagai Siswa terbantu ketika bertanya mengenai materi.,terimakasih bapak beri materi antar rpl sangat baik bagai siswa bantu tanya kena materi,positif
selalu melaukan perbaikan dan evaluasi Pelajaran,selalu lauk baik evaluasi ajar,positif
sudah sangat baik dalam membimbing Siswa,sangat baik bimbing siswa,positif
"sarannya, semoga pak lebih interaktif kepada Siswa saat mengajar",saran moga pak lebih interaktif siswa ajar,negatif
Materi yang diberikan lengkap & kompleks. Mengajarkan karakter & mindset yang baik kepada siswa.Hanya saja ketika menyampaikan materi saya masih kurang puas dengan penyampaian materinya yang agak sedikit monoton. Saya butuh penjelasan lebih lanjut terhadap point2 yang ada & bagaimana penerapannya nanti. Terimakasih,materi beri lengkap kompleks ajar karakter mindset baik siswa saja sampai materi masih kurang puas sampai materi agak sedikit monoton butuh jelas lebih lanjut point ada bagaimana terap terimakasih,negatif
unknow,unknow,positif
Selalu melakukan hal yang terbaik untuk siswanya,selalu laku yang baik siswa,positif
"Kesan saya kepada ibu ini orangnya sangat baik walaupun terlihat tegas tapi aslinnya baik banget, mudah diajak bercanda, dan",kesan kepada ibu orang sangat baik walaupun lihat tegas aslinnya baik banget mudah ajak canda,positif
"Komunikasi dan interaksi ibu pada pengajaran di kelas sangatlah baik, disamping jenis Pelajaran yang tergolong susah, pembawaannya dapat dimengerti Siswa",komunikasi interaksi ibu ajar kelas sangat baik samping jenis ajar golong susah bawa erti siswa,positif
Proses pembelajaran yang mudah dipahami,proses ajar mudah paham,positif
Jika mengasih tugas jangan terlalu berat,asih tugas jangan terlalu berat,negatif
mungkin bisa diperlambat penjelasannya karena terkadang agak kecepetan,mungkin lambat jelas terkadang kecepetan,negatif
semoga bisa lebih baik lagi,moga lebih baik,positif
untuk tulisan di papan semoga lebih jelas,tulis papan moga lebih jelas,positif
"tidak ada, terima kasih Pak",tidak terima kasih pak,positif
"Untuk penyampaian materi dari Bu sudah baik, namun terkadang suaranya kurang keras",sampai materi bu baik terkadang suara kurang keras,negatif
"sudah lebih baik dari semester kemarin, tetap seperti ini bu",lebih baik semester kemarin tetap ini bu,positif
Sangat kompeten,sangat kompeten,positif
Terimakasih untuk bu guru telah memberika materi Logika Matematika dengan sangat baik. Saran saya semoga kedepanya lebih professional lagi dengan on cam pada saat mengajar online di zoom.,terimakasih bu guru memberika materi logika matematika sangat baik saran moga depa lebih professional dengan on cam saat ajar online zoom,negatif
"Lebih berkomitmen lagi dalam mengajar, jika sudah mengambil tanggung jawab untuk mengajar jangan sering ditinggalkan, atau untuk mengatasi bisa ubah jadwal",lebih komitmen dalam ajar sudah ambil tanggung jawab ajar jangan sering tinggal untuk atas ubah jadwal,negatif
untuk metode belajar di tingkatkan lagi,metode ajar tingkat,negatif
jangan suka ngelucu sendiri pak dan jangan suka marah2 sendiri,jangan suka ngelucu sendiri pak jangan suka marah sendiri,negatif
Sebaiknya di adakan praktikum untuk materi yang aka di berikan pada tugas besar,baik adakan praktikum materi aka ikan tugas besar,negatif
mungkin untuk pembawaannya dari guru masih kurang jadi lebih di tingkatkan,mungkin bawa guru kurang jadi lebih tingkat,negatif
semoga kedepan nya bisa lebih baik lagi,moga depan nya lebih baik,positif
dari materi sangat mudah dimengerti,materi sangat mudah erti,positif
kalau menerangkan dimohon tidak terlalu cepat bu :),kalau terang mohon tidak terlalu cepat bu,negatif
untuk kedepannya pak kalau menjelaskan materi jangan terlalu cepat,depan pak kalau jelas materi jangan terlalu cepat,negatif
"suara saat mengajar kurang keras, lainya sudah bagus.",suara ajar kurang keras lai bagus,negatif
"Jarang masuk kelas ,siswa disuruh belajar otodidak tanpa diajarkan apapun untuk persiapan uts maupun uas, cara mengajarnya kurang karena sering keluar dari topik pelajaran.",jarang masuk kelas siswa suruh ajar otodidak ajar apa siap uts maupun uas cara ajar kurang sering keluar topik ajar,negatif
Berharap di semester depan ketemu lagi sama ibu <3,harap semester depan ketemu sama ibu,positif
"Saran dari saya, Bapak Guru sekiranya lebih pelanpelan dalam memberikan materi Pelajaran, sehingga kami dapat memahami satu persatu materi dengan baik. Terimakasih bapak¿¿¿¿",saran saya bapak guru sekira lebih pelanpelan beri materi ajar kami paham satu satu materi baik terimakasih bapak,negatif
"cara mengajarnya udah bagus,terimkasih buat bapak alhamdulillah berkat bapak guru saya mulai mengetahui banyak hal mengenai agama ini,mulai dari sejarahnya dan sebaganya .",cara ajar udah bagus terimkasih buat bapak alhamdulillah berkat bapak guru mulai tahu banyak kena agama mulai sejarah sebaganya,positif
Semakin baik untuk kedepannya,makin baik depan,positif
Materi m operasional lumayan sulit namun menjadi dapat mudah dipahami,materi m operasional lumayan sulit jadi mudah paham,positif
Belim ada,belim,positif
Semoga guru semakin handal dalam memberi materi dan keteladanan kepada para Siswa,moga guru makin handal beri materi teladan para siswa,positif
"sebaiknya metode pembelajarannya dipertahankan, karena pembelajaran dicampur dengan humor membuat Siswa tidak jenuh dan dengan lebih mudah memahami materi, disertai dengan praktikum",baik metode ajar tahan ajar campur humor buat siswa tidak jenuh lebih mudah paham materi serta dengan praktikum,positif
Penjelasan sulit dipahami,jelas sulit paham,negatif
semangat,semangat,positif
"tidak ada karena menurut saya, cara mengajar pak sudah sangat baik",tidak karena saya cara ajar pak sangat baik,positif
"sharescreen/waktu beliau paparkan materi itu mungkin bisa lebih di urutin lagi, beliau kalau paparkan materinya itu terlalu cepat.",sharescreen waktu beliau papar materi mungkin lebih urutin beliau kalau papar materi terlalu cepat,negatif
Semangat pak jangan susah susah tugas nya dan untuk soal kuis nya jangan banyak banyak pak,semangat pak jangan susah susah tugas nya untuk soal kuis nya jangan banyak banyak pak,positif
sudah baik asli,baik asli,positif
sangat bagus ¿¿¿¿,sangat bagus,positif
lebih sabar lagi,lebih sabar,negatif
semangat terus pak,semangat terus pak,positif
"untuk pengajaran ibu sudah bagus hanya saja seperti Pelajaran lain yang dilakukan secara online, memiliki kurangnya efektifitas dalam melakukan interaksi pengajaran",ajar ibu bagus saja ajar yang laku online milik kurang efektifitas laku interaksi ajar,positif
"terima kasih bapak atas ilmu yang diberikan selama satu semester ini, saran untuk metode pembelajaran lebih memberikan materi tentang Pelajaran, tidak menggunakan konsep diskusi di setiap pertemuan",terima kasih bapak atas ilmu beri lama satu semester saran metode ajar lebih beri materi ajar tidak guna konsep diskusi tiap temu,negatif
oke,oke,positif
Saat penyampaian materi bisa ditunjukkan video animasi.,sampai materi tunjuk video animasi,negatif
"dalam proses mengajar telah memberikan materi dengan baik dan mudah dipahami, semoga semester depan masih di ampu dengan guru ini",proses ajar beri materi baik mudah paham moga semester depan di ampu guru,positif
Bagus,bagus,positif
Sudah sangat baik jikalau bisa soal UAS nya jangan susah susah,sangat baik jikalau soal uas nya jangan susah susah,positif
Kereen¿¿¿¿¿¿¿¿,kereen,positif
semoga lebih baik,moga lebih baik,positif
lum ada,lum,positif
"Saran dari saya, bapak/ibu dapat menyesuaikan metode pembelajaran yang aktif kepada siswa/i agar tidak monoton sebatas penjelasan semata.",saran saya bapak ibu sesuai metode ajar aktif siswa i tidak monoton batas jelas semata,negatif
"Bu , joss",bu joss,positif
Tolong agar tidak memakai guru luar biasa untuk Pelajaran umum jurusan karena pertemuan hanya dilakukan online setaip jadwal kelas berlangsung sehingga saya merasa kesulitan untuk menangkap materi dan hanya sering di beri tugas merangkum ppt saja. Terima kasih,agar tidak pakai guru luar biasa ajar umum jurus temu laku online setaip jadwal kelas langsung saya rasa sulit tangkap materi hanya sering beri tugas rangkum ppt terima kasih,negatif
tetap semangat dan sabar dalam melakukan penyampaian materi kepada siswa.,tetap semangat sabar laku sampai materi siswa,positif
dikasih latihan soal lagi disetiap pertemuannya agar lebih paham lagi,kasih latih soal tiap temu lebih paham,negatif
terimakasih bu atas pembelajaran disemester ini.,terimakasih bu atas ajar semester,positif
sudah sangat baik pak pertahankan,sangat baik pak tahan,positif
Saran saya supaya dipertahankan karena proses menjelaskan materi kepada Siswa sangat jelas dan sangat bisa dipahami.,saran supaya tahan proses jelas materi siswa sangat jelas sangat paham,negatif
Saya sendiri masih bingung tujuan dri mapel studium ini sendiri karena jarang ada pemaparan materi dan yg saya tau mapel ini hanya seperti bimbingan bersana guru wali,sendiri bingung tuju dri mapel studium sendiri jarang papar materi yg tau mapel hanya bimbing sana guru wali,negatif
Respect pak,respect pak,positif
Penyampaiannya lebih di permudah,sampai lebih mudah,negatif
terimakasih Pak telah mengajar saya. mohon bimbingannya kedepan,terimakasih pak ajar mohon bimbing depan,positif
hehe,hehe,positif
ngoding itu susah pak...,ngoding susah pak,negatif
